{
  "schema_version": "1.0.0",
  "project": "Morphoia Engine",
  "profile": "e2-salome-protocol-contract",
  "generated_at": "2026-08-12",
  "manifest_document_license": "CC-BY-4.0",
  "hash_algorithm": "sha256",
  "artifacts": [
    {
      "id": "adr-019",
      "kind": "architecture-decision-record",
      "path": "spec/adr/ADR-019-salome-control-protocol-v0.1.md",
      "media_type": "text/markdown",
      "size_bytes": 4843,
      "sha256": "7581e07695e567690df5ff61784acdfae33d8b3eb8a160cd68721da0fc82fda7",
      "license_expression": "CC-BY-4.0",
      "provenance": "Original E2 protocol-boundary decision authored for Morphoia Engine.",
      "verification_status": "PASS",
      "vulnerability_analysis_status": "NOT_RUN"
    },
    {
      "id": "salome-protocol-schema-0.1",
      "kind": "protocol-schema",
      "path": "schemas/morphoia-salome-protocol-0.1.schema.json",
      "media_type": "application/schema+json",
      "size_bytes": 40166,
      "sha256": "8c20efe80430168151cb197bd27f45d86515f7ee05451a910ff92e32fe249963",
      "license_expression": "MIT",
      "source_artifact_id": "adr-019",
      "provenance": "Versioned control schema implementing the boundary selected by ADR-019.",
      "verification_status": "PASS",
      "vulnerability_analysis_status": "NOT_RUN"
    },
    {
      "id": "salome-protocol-contract",
      "kind": "contract-implementation",
      "path": "src/morphoia/salome_protocol/contract.py",
      "media_type": "text/x-python",
      "size_bytes": 4847,
      "sha256": "c06b3f4187e0ad855cd5e25e90e79e864a5f9ca04804e7c32135fffdcdacb19e",
      "license_expression": "MIT",
      "source_artifact_id": "salome-protocol-schema-0.1",
      "provenance": "Strict bounded JSON transport helpers for the protocol schema.",
      "verification_status": "PASS",
      "vulnerability_analysis_status": "NOT_RUN"
    },
    {
      "id": "fake-salome-agent",
      "kind": "contract-implementation",
      "path": "src/morphoia/salome_protocol/fake_agent.py",
      "media_type": "text/x-python",
      "size_bytes": 13710,
      "sha256": "3e4ba847a3df3fcd5dcc1b405d2ebd82519d86e75458aa22bec5b8c791d01320",
      "license_expression": "MIT",
      "source_artifact_id": "salome-protocol-contract",
      "provenance": "Explicitly fake contract lifecycle implementation with no SALOME runtime.",
      "verification_status": "PASS",
      "vulnerability_analysis_status": "NOT_RUN",
      "note": "Contract-test fake only; it is not real SALOME execution evidence."
    },
    {
      "id": "salome-protocol-package-init",
      "kind": "contract-implementation",
      "path": "src/morphoia/salome_protocol/__init__.py",
      "media_type": "text/x-python",
      "size_bytes": 471,
      "sha256": "7d26ad9a946a166206ce304240f81b7b78651c3a526da4b52cc909ff87d2a2c7",
      "license_expression": "MIT",
      "source_artifact_id": "fake-salome-agent",
      "provenance": "Public package exports for the bounded E2 contract surface.",
      "verification_status": "PASS",
      "vulnerability_analysis_status": "NOT_RUN"
    },
    {
      "id": "salome-protocol-contract-tests",
      "kind": "contract-test",
      "path": "tests/test_salome_protocol.py",
      "media_type": "text/x-python",
      "size_bytes": 19536,
      "sha256": "85065138701cb4d1da1adf02cd7fabe6b9973d7747ad4896204542a7856446b8",
      "license_expression": "Apache-2.0 OR MIT",
      "source_artifact_id": "salome-protocol-package-init",
      "provenance": "Positive, negative, lifecycle, and truth-boundary tests for the fake contract.",
      "verification_status": "PASS",
      "vulnerability_analysis_status": "NOT_RUN"
    },
    {
      "id": "e2-artifact-manifest-schema",
      "kind": "evidence-schema",
      "path": "spec/evidence/e2-salome-protocol-artifact-manifest.schema.json",
      "media_type": "application/schema+json",
      "size_bytes": 4118,
      "sha256": "d959564e8bca9e60f9f23f7ed87e499b52ae5a00d4b77ef76d8ba50d8d39bc4d",
      "license_expression": "Apache-2.0 OR MIT",
      "provenance": "Closed schema for the bounded E2 evidence profile.",
      "verification_status": "PASS",
      "vulnerability_analysis_status": "NOT_RUN"
    },
    {
      "id": "e2-traceability-schema",
      "kind": "evidence-schema",
      "path": "spec/evidence/e2-salome-protocol-traceability.schema.json",
      "media_type": "application/schema+json",
      "size_bytes": 2303,
      "sha256": "e65b7f45a2523741b20887bc53e95593611ddaa77e1d468b60c9d89518e6519d",
      "license_expression": "Apache-2.0 OR MIT",
      "source_artifact_id": "e2-artifact-manifest-schema",
      "provenance": "Closed schema separating contract evidence from real SALOME status.",
      "verification_status": "PASS",
      "vulnerability_analysis_status": "NOT_RUN"
    },
    {
      "id": "e2-traceability",
      "kind": "traceability",
      "path": "spec/evidence/e2-salome-protocol-traceability.json",
      "media_type": "application/json",
      "size_bytes": 5327,
      "sha256": "ed1d65c6dcaf16c51a6ea66d3d4b2ce770379b980e76463246aa19d801036641",
      "license_expression": "CC-BY-4.0",
      "source_artifact_id": "e2-traceability-schema",
      "provenance": "Requirement-to-test-to-evidence mapping for source commit aec106f.",
      "verification_status": "PASS",
      "vulnerability_analysis_status": "NOT_RUN"
    },
    {
      "id": "schema-tests",
      "kind": "schema-test",
      "path": "tests/test_schemas.py",
      "media_type": "text/x-python",
      "size_bytes": 4175,
      "sha256": "65b40357498ff8e21895b3998170a5f23bac31ffe056c69d9c7d87ff6c73201f",
      "license_expression": "MIT",
      "source_artifact_id": "e2-traceability-schema",
      "provenance": "Draft 2020-12 meta-schema checks extended for the E2 evidence schemas.",
      "verification_status": "PASS",
      "vulnerability_analysis_status": "NOT_RUN"
    },
    {
      "id": "e2-sbom-generator",
      "kind": "evidence-generator",
      "path": "scripts/generate_engine_e2_sbom.py",
      "media_type": "text/x-python",
      "size_bytes": 43937,
      "sha256": "e189c5f56f895fdcbc80e41ff001c00494cd3a89a271c786e6903dac017b9c90",
      "license_expression": "Apache-2.0 OR MIT",
      "source_artifact_id": "e2-artifact-manifest-schema",
      "provenance": "Deterministic standard-library generator and fail-closed checker.",
      "verification_status": "PASS",
      "vulnerability_analysis_status": "NOT_RUN"
    },
    {
      "id": "e2-evidence-tests",
      "kind": "evidence-test",
      "path": "tests/test_e2_evidence.py",
      "media_type": "text/x-python",
      "size_bytes": 13956,
      "sha256": "5f03a15bb2168b32a7ea31f2aca7919e554a7c61554a0fd990e222c593634ede",
      "license_expression": "Apache-2.0 OR MIT",
      "source_artifact_id": "e2-sbom-generator",
      "provenance": "Mutation, immutability, schema, allowlist, lock, and deterministic-output tests.",
      "verification_status": "PASS",
      "vulnerability_analysis_status": "NOT_RUN"
    },
    {
      "id": "e2-protocol-gate-report",
      "kind": "gate-report",
      "path": "docs/engine/evidence/E2_PROTOCOL_GATE_REPORT.md",
      "media_type": "text/markdown",
      "size_bytes": 11931,
      "sha256": "0f2a988a5bb3cb5f957d9f07befdadc0faee4cfd0f71795da33265493ddd84dc",
      "license_expression": "CC-BY-4.0",
      "source_artifact_id": "e2-traceability",
      "provenance": "Gate report preserving local and hosted results and their evidence limits.",
      "verification_status": "PASS",
      "vulnerability_analysis_status": "NOT_RUN",
      "note": "The report artifact retains the initial hosted FAIL, final integration PASS, and real SALOME NOT_RUN boundary."
    },
    {
      "id": "sbom-engine-e2-salome-protocol",
      "kind": "cyclonedx-sbom",
      "path": "artifacts/sbom/engine-e2-salome-protocol.cdx.json",
      "media_type": "application/vnd.cyclonedx+json",
      "size_bytes": 23413,
      "sha256": "4fa388d66db998127161c373a54a937eb55099706ec935a9f05fc0013b77431f",
      "license_expression": "CC-BY-4.0",
      "source_artifact_id": "e2-sbom-generator",
      "provenance": "Deterministic CycloneDX 1.5 inventory generated from this closed profile.",
      "verification_status": "PASS",
      "vulnerability_analysis_status": "NOT_RUN",
      "note": "Inventory only; no vulnerability analysis or real SALOME execution is claimed."
    }
  ]
}
